{
    "name": "ash",
    "editorIds": [
        "AshMaterial*",
        "DLC2AshMaterial*",
        "AshLODMaterial*"
    ],
    "excludeEditorIds": [],
    "pbr": true,
    "diffuseTexture": "textures/pbr/dlc02/landscape/volcanic_ash_01.dds",
    "normalTexture": "textures/pbr/dlc02/landscape/volcanic_ash_01_n.dds",
    "neutralizeVertexColors": true,
    "neutralizeVertexAlpha": true,
    "roofShelter": true,
    "shelterFade": 64
}